candidate_id,name.x,party,state,district,cycles,name.y,committee_id
H8NV02152,"ALM, VANCE STEVEN",DEM,NV,2,"{2018,2020}",COMMITTEE TO ELECT VANCE ALM FOR CONGRESS,C00676494
H8NV03101,"HART, RICHARD CRAIG",DEM,NV,3,"{2018,2020}",RICHARD C HART  FOR US CONGRESS,C00648154
H8NV03119,"HAMMOND, SCOTT",REP,NV,3,{2018},HAMMOND FOR CONGRESS,C00649418
H8NV03127,"FARAHI, HERMON",DEM,NV,3,{2018},HERMON FOR THE PEOPLE,C00649715
H8NV03135,"HAMILTON, EDDIE ""MR MAGA""",REP,NV,3,"{2018,2020}",EDDIE MR MAGA HAMILTON FOR U.S. CONGRESS,C00655597
H8NV03150,"MCKEON, DAVID OWEN",REP,NV,3,{2018},MCKEON FOR NEVADA,C00647974
H8NV03168,"WEISS, MICHAEL",DEM,NV,3,{2018},MICHAEL WEISS FOR NEVADA,C00651968
H8NV03176,"TACHE, LYNDA",REP,NV,3,{2018},THE COMMITTEE TO ELECT LYNDA TACHE,C00651992
H8NV03184,"SEAMAN, VICTORIA",REP,NV,3,"{2018,2020}",VICTORIA SEAMAN FOR CONGRESS,C00652354
H8NV03192,"LOVE, JOHN DENNIS",DEM,NV,3,"{2018,2020}",LOVE FOR NEVADA 2018,C00654566
H8NV03218,"MORTENSEN, MICHELLE",REP,NV,3,"{2018,2020}",MORTENSEN FOR CONGRESS,C00660183
H8NV03226,"PINJUV, GUY",DEM,NV,3,{2018},COMMITTEE TO ELECT GUY PINJUV,C00660563
H8NV03234,"JONES, STEPHANIE",REP,NV,3,{2018},STEPHANIE JONES FOR CONGRESS,C00663773
H8NV03242,"EISNER, GILBERT MR.",NON,NV,3,"{2018,2020}",EISNER4CONGRESS,C00669721
H8NV03259,"CARTER, PATRICK",REP,NV,3,{2018},CARTER CONGRESSIONAL CAMPAIGN,C00670471
H8NV03267,"GUMINA, TONY DR",NNE,NV,3,"{2018,2020}",FRIENDS OF TONY GUMINA,C00674283
H8NV04018,"VILELA, AMY",DEM,NV,4,"{2018,2020}",AMY FOR THE PEOPLE,C00649707
H8NV04034,"ANZALONE, JOHN ANTHONY DR.",DEM,NV,4,"{2018,2020}",JOHN ANZALONE FOR CONGRESS,C00663930
H8NV04042,"SPEARMAN, PATRICIA",DEM,NV,4,{2018},SPEARMAN FOR CONGRESS,C00664565
H8NV04067,"MILLER, JEFF",REP,NV,4,"{2018,2020}",JEFF MILLER FOR NEVADA,C00666826
H8NV04075,"WEGNER, KENNETH A",REP,NV,4,"{2018,2020}",WEGNER FOR CONGRESS,C00671255
H8NV04083,"GIBBS, DAVID",REP,NV,4,{2018},DAVID GIBBS FOR NEVADA,C00672048
H8NV04109,"TOWNSEND, WILLIAM BILL MILLER",REP,NV,4,{2018},THE TOWNSEND CAMPAIGN,C00671701
H8NV04117,"STEPHENS, ALLISON A",DEM,NV,4,"{2018,2020}",ALLISON STEPHENS FOR CONGRESS,C00669978
H8NY01155,"GERSHON, PERRY",DEM,NY,1,"{2018,2020}",PERRY GERSHON FOR CONGRESS,C00650457
H8NY01163,"PECHEFSKY, DAVID",DEM,NY,1,"{2018,2020}",PECHEFSKY FOR CONGRESS,C00651372
H8NY01171,"HENRY, BRENDON T",DEM,NY,1,"{2018,2020}",FRIENDS OF BRENDON HENRY,C00651950
H8NY01189,"DIMASI, ELAINE DR. PHD",DEM,NY,1,{2018},DIMASI FOR CONGRESS,C00652586
H8NY01197,"BROWNING, KATE M.",DEM,NY,1,"{2018,2020}",KATE BROWNING FOR CONGRESS,C00657825
H8NY01205,"MILLER, BRUCE GORDON MR.",DEM,NY,1,{2018},FRIENDS OF BRUCE MILLER,C00665976
H8NY02070,"GOMES, TIM",DEM,NY,2,"{2018,2020}",TIM GOMES FOR CONGRESS,C00656215
H8NY02088,"SAX, MIKE",DEM,NY,2,"{2018,2020}",FRIENDS OF MIKE SAX,C00691824
H8NY02088,"SAX, MIKE",DEM,NY,2,"{2018,2020}",MIKE SAX FOR CONGRESSIONAL DISTRICT 2,C00660324
H8NY02104,"GRECHEN SHIRLEY, LIUBOV LIUBA",DEM,NY,2,"{2018,2020}",LIUBA FOR CONGRESS,C00657015
H8NY02112,"THOMAS, KEVIN",DEM,NY,2,"{2018,2020}",KEVIN THOMAS FOR CONGRESS,C00669267
H8NY03151,"DEBONO, DAN",REP,NY,3,"{2018,2020}",DEBONO FOR CONGRESS,C00651497
H8NY03169,"MICHAILIDIS, CONSTANTINOS",NNE,NY,3,{2018},COSTA 2018,C00653907
H8NY03177,"SAUBERMAN, JOSHUA A",IND,NY,3,"{2018,2020}",JOSH FOR NY,C00654889
H8NY04084,"BENNO, AMEER",REP,NY,4,"{2018,2020}",BENNO FOR CONGRESS,C00675587
H8NY05107,"ACHILLE, CARL H.",DEM,NY,5,"{2018,2020}",FRIENDS OF CARL ACHILLE FOR CONGRESS,C00669952
H8NY05115,"MARTHONE, JOSEPH R.",DEM,NY,5,"{2018,2020}",MARTHONE FOR CONGRESS,C00671024
H8NY05123,"CHOUDHURY, MIZANUR",DEM,NY,5,"{2018,2020}",MIZAN FOR CONGRESS,C00673236
H8NY06113,"HILLGARDNER, THOMAS J",GRE,NY,6,"{2018,2020}",COMMITTEE TO ELECT TOM HILLGARDNER TO CONGRESS,C00673798
H8NY09158,"BUNKEDDEKO, ADEM",DEM,NY,9,"{2018,2020}",FRIENDS OF ADEM,C00656793
H8NY09166,"JOYNER, JOHN JOSEPH MR JR",REP,NY,9,{2018},VOTE JOHN JOSEPH JOYNER JR 4 CONGRESS,C00671974
H8NY09174,"GAYOT, LUTCHI",REP,NY,9,"{2018,2020}",TEAM GAYOT,C00673244
H8NY10081,"LYNCH, HOLLY",DEM,NY,10,"{2018,2020}",NEW YORKERS AND FRIENDS FOR HOLLY LYNCH,C00658070
H8NY10099,"LEVIN, NAOMI",REP,NY,10,"{2018,2020}",FRIENDS OF NAOMI,C00672360
H8NY11063,"MELSON, BOYD",DEM,NY,11,"{2018,2020}",BOYD MELSON FOR CONGRESS,C00637587
H8NY11071,"EMIG, ZACH",DEM,NY,11,{2018},ZACH EMIG FOR CONGRESS,C00639575
H8NY11089,"DEVITO, MICHAEL JR",DEM,NY,11,"{2018,2020}",DEVITO FOR CONGRESS,C00640227
H8NY11097,"DECILLIS, ALFRED MICHAEL",DEM,NY,11,"{2018,2020}",MIKE DECILLIS FOR CONGRESS,C00640995
H8NY11105,"VAID, OMAR M",DEM,NY,11,"{2018,2020}",OMAR VAID FOR CONGRESS,C00647313
H8NY11113,"ROSE, MAX",DEM,NY,11,"{2018,2020}",MAX ROSE FOR CONGRESS,C00652248
H8NY11121,"SPERLING, PAUL",DEM,NY,11,"{2018,2020}",PAUL SPERLING 2018,C00655365
H8NY11139,"MOHAN, RADHAKRISHNA",DEM,NY,11,"{2018,2020}",MOHAN FOR CONGRESS,C00659342
H8NY11147,"AUBIN, MARK-CHRISTIAN ANTHONY",REP,NY,11,"{2018,2020}",MARK FOR THE NEXT GENERATION COMMITTEE,C00674648
H8NY12137,"HICKS, SANDER",DEM,NY,12,"{2018,2020}",HICKS FOR CONGRESS,C00664540
H8NY12145,"RABIN, ELIOT MR.",REP,NY,12,"{2018,2020}",ELIOT RABIN-PETER ELIOT FOR CONGRESS,C00680900
H8NY13143,"THOMAS, JEFFERSON MR.",DEM,NY,13,"{2018,2020}","JEFFERSON THOMAS FOR CONGRESS, 13TH DISTRICT, NEW YORK STATE",C00659037
H8NY13150,"BUTLER, JINEEA THE NEW AM",REP,NY,13,"{2018,2020}",JINEEA BUTLER FOR CONGRESS,C00673996
H8NY14133,"PAPPAS, ANTHONY",REP,NY,14,"{2018,2020}",PEOPLE FOR ANTHONY PAPPAS FOR CONGRESS,C00686006
H8NY14133,"PAPPAS, ANTHONY",REP,NY,14,"{2018,2020}",ANTHONY PAPPAS FOR CONGRESS,C00689349
H8NY15148,"OCASIO-CORTEZ, ALEXANDRIA",DEM,NY,14,"{2018,2020}",ALEXANDRIA OCASIO-CORTEZ FOR CONGRESS,C00639591
H8NY16096,"LEWIS, JONATHAN",DEM,NY,16,{2018},JONATHAN LEWIS FOR CONGRESS 2018,C00673343
H8NY17110,"CIARDULLO, JOSEPH JOHN",REF,NY,17,"{2018,2020}",AMERICANS FOR JOE CIARDULLO,C00679936
H8NY18266,"BUCHANAN, JARRED ROBERT MR.",REP,NY,18,"{2018,2020}",JARRED BUCHANAN FOR CONGRESS,C00664672
H8NY18274,"O'DONNELL, JAMES D",REP,NY,18,"{2018,2020}",O'DONNELL FOR CONGRESS,C00668798
H8NY19173,"FLYNN, BRIAN",DEM,NY,19,"{2018,2020}",BRIAN FLYNN FOR CONGRESS,C00633867
H8NY19181,"DELGADO, ANTONIO",DEM,NY,19,"{2018,2020}",DELGADO FOR CONGRESS,C00633859
H8NY19199,"RHODES, GARETH THOMAS",DEM,NY,19,"{2018,2020}",GARETH RHODES FOR CONGRESS,C00639559
H8NY19207,"SULLIVAN, SUE",DEM,NY,19,{2018},SUE SULLIVAN FOR CONGRESS,C00640680
H8NY19215,"BEALS, JEFFREY",DEM,NY,19,"{2018,2020}",JEFF BEALS FOR CONGRESS,C00641035
H8NY19223,"RYAN, PATRICK",DEM,NY,19,"{2018,2020}",PATRICK RYAN FOR CONGRESS,C00647115
H8NY19231,"CLEGG, DAVID J",DEM,NY,19,{2018},DAVE CLEGG FOR CONGRESS,C00649012
H8NY19249,"NEAL, DIANE",NPA,NY,19,"{2018,2020}",FRIENDS OF DIANE NEAL,C00668087
H8NY19256,"COLLIER, ERIN",DEM,NY,19,{2018},ERIN COLLIER FOR CONGRESS,C00671412
H8NY21245,"COBB, TEDRA",DEM,NY,21,"{2018,2020}",COMMITTEE TO ELECT TEDRA COBB,C00649061
H8NY21252,"WILSON, KATIE",DEM,NY,21,"{2018,2020}",KATIE WILSON FOR CONGRESS,C00650531
H8NY21260,"MARTZ, EMILY",DEM,NY,21,"{2018,2020}",EMILY MARTZ FOR CONGRESS,C00650358
H8NY21286,"BOYAJIAN, DON",DEM,NY,21,{2018},DON BOYAJIAN FOR CONGRESS,C00652172
H8NY21294,"KIM, RONALD JOSEPH MR.",DEM,NY,21,"{2018,2020}",COMMITTEE TO ELECT RONALD KIM,C00653956
H8NY21302,"BOONE, TANYA",DEM,NY,21,{2018},TANYA BOONE FOR CONGRESS,C00658500
H8NY21310,"SCHNIBBE, STEVEN C.",REP,NY,21,"{2018,2020}",WE THE PEOPLE OF THE NEW YORK 21 FOR STEVE SCHNIBBE,C00658690
H8NY21328,"IDLEMAN, SARA",DEM,NY,21,"{2018,2020}",FRIENDS OF SARA IDLEMAN,C00664391
H8NY21336,"MASTRIANNI, DAVID",DEM,NY,21,"{2018,2020}","DAVID MASTRIANNI, MD FOR CONGRESS",C00665497
H8NY21344,"RATIGAN, DYLAN",DEM,NY,21,{2018},DYLAN RATIGAN FOR CONGRESS,C00671057
H8NY21351,"KAHN, LYNN SANDRA",GRE,NY,21,"{2018,2020}",LYNN KAHN 4 NY21 CAMPAIGN COMMITTEE,C00683540
H8NY22144,"MADDEN, PATRICK",DEM,NY,22,{2018},PATRICK MADDEN FOR CONGRESS,C00640482
H8NY22151,"BRINDISI, ANTHONY",DEM,NY,22,"{2018,2020}",BRINDISI FOR CONGRESS,C00648725
H8NY22169,"PHILLIPS, HEATH",DEM,NY,22,{2018},HEATH PHILLIPS FOR CONGRESS,C00650085
H8NY23134,"SUNDQUIST, EDWARD A.",DEM,NY,23,"{2018,2020}",FRIENDS OF EDDIE SUNDQUIST,C00641175
H8NY23142,"GALLANT, RICK",DEM,NY,23,"{2018,2020}",COMMITTEE TO ELECT RICK GALLANT,C00641365
H8NY23159,"HERTZLER, JOHN G",IND,NY,23,"{2018,2020}",COMMITTEE TO ELECT JOHN G HERTZLER,C00647511
H8NY23167,"GOLDEN, IAN",DEM,NY,23,"{2018,2020}",GOLDEN FOR CONGRESS,C00649285
H8NY23175,"DELLA PIA, MAX HAROLD",DEM,NY,23,{2018},MAX DELLA PIA FOR CONGRESS,C00649954
H8NY23183,"MITRANO, TRACY",DEM,NY,23,"{2018,2020}",THE FRIENDS OF TRACY MITRANO COMMITTEE,C00654525
H8NY23191,"CLASBY, JAMES BRIAN LONE CROW",IND,NY,23,"{2018,2020}",CLASBY FOR CONGRESS,C00654962
H8NY23217,"WHALEN, CHARLES",DEM,NY,23,{2018},CHARLES WHALEN FOR CONGRESS,C00656918
H8NY23225,"ANDREI, LINDA",DEM,NY,23,{2018},LINDA ANDREI M.D. FOR CONGRESS,C00663427
H8NY24082,"MESSENGER, ANNE",DEM,NY,24,{2018},MESSENGER FOR CONGRESS INC,C00649988
H8NY24090,"BALTER, DANA",DEM,NY,24,"{2018,2020}",FRIENDS OF DANA BALTER,C00655183
H8NY24108,"COMEGYS, CHRISTOPHER SCOTT",DEM,NY,24,{2018},SCOTT COMEGYS FOR CONGRESS,C00660365
H8NY24116,"BASS, WILLIAM HENRY MR. JR",NPA,NY,24,"{2018,2020}",FRIENDS OF BILL BASS,C00667303
H8NY24124,"SONALLAH, ZACH 1994",DEM,NY,24,"{2018,2020}",COMMITTEE TO ELECT ZACH SONALLAH,C00674002
H8NY24132,"PEREZ WILLIAMS, JUANITA",DEM,NY,24,{2018},JUANITA FOR CONGRESS,C00675538
H8NY25097,"MAXWELL, JAMES T. DR",REP,NY,25,"{2018,2020}",DR. JIM MAXWELL FOR CONGRESS,C00666164
H8NY25105,"MORELLE, JOSEPH D",DEM,NY,25,"{2018,2020}",JOE MORELLE FOR CONGRESS,C00675108
H8NY25113,"WILT, ROBIN",DEM,NY,25,"{2018,2020}",ROCHESTER FOR ROBIN,C00674788
H8NY25121,"BARNHART, RACHEL",DEM,NY,25,"{2018,2020}",RACHEL FOR CONGRESS,C00676312
H8NY26137,"ZENO, RENEE MARIE MISS",REP,NY,26,"{2018,2020}",ZENO FOR CONGRESS,C00679050
H8NY27119,"BANKS, JAMES PAUL MR.",REP,NY,27,"{2018,2020}",JIM BANKS FOR CONGRESS,C00651232
H8NY27127,"COLE, ERIN",DEM,NY,27,{2018},ERIN COLE FOR CONGRESS,C00650895
H8NY27135,"BUNNY, SEAN",DEM,NY,27,{2018},BUNNY FOR CONGRESS,C00658393
H8NY27143,"STANKEVICH, NICHOLAS RICHARD MR.",DEM,NY,27,{2018},FRIENDS OF NICHOLAS STANKEVICH,C00658740
H8NY27150,"PIEGZA, LAWRENCE MARK",NPA,NY,27,"{2018,2020}",COMMITTEE TO ELECT LARRY PIEGZA; THE,C00664458
H8NY27168,"SEAMANS, JOAN ELIZABETH",DEM,NY,27,{2018},FRIENDS OF JOAN ELIZABETH SEAMANS,C00665141
H8NY27176,"MCMURRAY, NATHAN DOUGLAS",DEM,NY,27,"{2018,2020}",NATE MCMURRAY FOR CONGRESS,C00666453
H8OH01084,"WEAVER, LAURA ANN",DEM,OH,1,"{2018,2020}",CAMPAIGN OF LAURA ANN WEAVER,C00635342
H8OH01118,"PUREVAL, AFTAB",DEM,OH,1,"{2018,2020}",AFTAB FOR OHIO,C00667519
H8OH02116,"EDWARDS, HAROLD JAMES III",DEM,OH,2,{2018},MICKEY EDWARDS FOR OHIO,C00635847
H8OH02124,"SCHILLER, JILL",DEM,OH,2,"{2018,2020}",JILL SCHILLER FOR CONGRESS,C00666743
H8OH04062,"MACKEY, ANDREW R.",DEM,OH,4,{2018},MACKEY FOR CONGRESS,C00633636
H8OH04070,"SELLERS, LEAH MS.",DEM,OH,4,"{2018,2020}",LEAH SELLERS FOR CONGRESS,C00670018
H8OH05150,"GALBRAITH, JOHN MICHAEL",DEM,OH,5,{2018},GALBRAITH FOR CONGRESS,C00638999
H8OH05168,"WOLFRUM, TODD",REP,OH,5,{2018},WOLFRUM FOR CONGRESS,C00659573
H8OH06117,"LANGE, WERNER",DEM,OH,6,{2018},WERNERLANGE4CONGRESS,C00667923
H8OH07123,"HARBAUGH, KENNETH",DEM,OH,7,"{2018,2020}",KEN HARBAUGH FOR CONGRESS,C00646752
H8OH07131,"PIKUS, PATRICK",DEM,OH,7,"{2018,2020}",COMMITTEE TO ELECT PATRICK PIKUS FOR US CONGRESS,C00668525
H8OH07149,"QUINN, PATRICK J",REP,OH,7,{2018},ELECT PATRICK J QUINN COMMITTEE,C00671495
H8OH08071,"JONES, THEODORE",DEM,OH,8,{2018},COMMITTEE TO ELECT THEODORE JONES,C00662635
H8OH08097,"ENOCH, VANESSA L. DR.",DEM,OH,8,"{2018,2020}",COMMITTEE TO ELECT ENOCH,C00667279
H8OH09087,"COLTON, KEITH C",REP,OH,9,"{2018,2020}",COLTON FOR CONGRESS,C00669689
H8OH09111,"KRAUS, STEVEN WAYNE MR.",REP,OH,9,"{2018,2020}",KRAUS FOR CONGRESS - OHIO 9TH DISTRICT,C00674838
H8OH10101,"MILISITS, MICHAEL JOSEPH",DEM,OH,10,{2018},MILISITS FOR THE PEOPLE,C00637157
H8OH10119,"GASPER, THERESA",DEM,OH,10,"{2018,2020}",THERESA GASPER FOR CONGRESS,C00665471
H8OH10135,"LITTLE, MICHAEL JAMES HARLESS",NNE,OH,10,"{2018,2020}",THE COMMITTEE TO ELECT MICHAEL LITTLE,C00672105
H8OH11281,"BELL, JAMES JEROME MR.",IND,OH,11,"{2018,2020}",THE FRIENDS OF JAMES JEROME BELL FOR CONGRESS 11TH CONGRESSIONAL DISTRICT OF OHIO,C00647305
H8OH11299,"BUTTS, REV PAMELA M PINKNEY",DEM,OH,11,"{2018,2020}",PINKNEYBUTTSUSA,C00661546
H8OH11315,"DUNHAM, GREGORY PAUL",REP,OH,11,{2018},DUNHAM FOR CONGRESS,C00671545
H8OH12123,"GRISEZ, BRANDON",REP,OH,12,"{2018,2020}",BRANDON GRISEZ FOR CONGRESS,C00631275
H8OH12131,"WILSON, DOUGLAS A",DEM,OH,12,"{2018,2020}","DOUG WILSON FOR CONGRESS, FINANCE COMMITTEE",C00637744
H8OH12149,"PETERS, JOHN",DEM,OH,12,"{2018,2020}",JOHN PETERS FOR THE 12TH,C00649889
H8OH12156,"VELEY, JONATHAN ALAN",IND,OH,12,"{2018,2020}",JONATHAN VELEY FOR CONGRESS,C00660142
H8OH12164,"SCOTT, ZACH",DEM,OH,12,"{2018,2020}",ZACH SCOTT FOR CONGRESS,C00662338
H8OH12180,"BALDERSON, WILLIAM TROY",REP,OH,12,"{2018,2020}",BALDERSON FOR CONGRESS,C00662650
H8OH12198,"HALVERSTADT, JONATHAN PHILIP MR.",REP,OH,12,"{2018,2020}",HALVERSTADT FOR CONGRESS,C00662684
H8OH12206,O'BRIEN CAROL,REP,OH,12,{2018},CAROL O'BRIEN FOR CONGRESS,C00662825
H8OH12214,"PATTON, JACKIE",DEM,OH,12,"{2018,2020}",JACKIE PATTON FOR CONGRESS,C00664011
H8OH12222,"BACON, KEVIN",REP,OH,12,{2018},BACON FOR CONGRESS,C00664821
H8OH12230,"LETT, CRYSTAL LYNN",DEM,OH,12,{2018},FRIENDS OF CRYSTAL LETT,C00665760
H8OH12248,"LENEGHAN, MELANIE ANN MRS.",REP,OH,12,"{2018,2020}",MELANIE LENEGHAN FOR CONGRESS,C00666073
H8OH12255,"COHEN, LAWRENCE",REP,OH,12,"{2018,2020}",LAWRENCE COHEN FOR CONGRESS,C00666503
H8OH12263,"KANE, TIM",REP,OH,12,"{2018,2020}",KANE FOR OHIO,C00666586
H8OH12271,"RUSSELL, JOHN",DEM,OH,12,"{2018,2020}",JOHN RUSSELL FOR CONGRESS,C00662403
H8OH12289,"MANLEY, PATRICK WILLIAM MR.",REP,OH,12,"{2018,2020}",CITIZENS FOR MANLEY,C00667394
H8OH12297,"O'CONNOR, DANIEL JAY",DEM,OH,12,"{2018,2020}",O'CONNOR FOR CONGRESS,C00667964
H8OH13139,"HARTMAN, DARRELL LYNN",REP,OH,16,"{2018,2020}",DARRELL HARTMAN FOR CONGRESS,C00634428
H8OH13147,"DEPIZZO, CHRIS",REP,OH,13,"{2018,2020}",CHRIS DEPIZZO FOR CONGRESS,C00659151
H8OH13154,"LYRAS, LOUIS GEORGE",NON,OH,13,"{2018,2020}",LYRAS FOR CONGRESS,C00682948
H8OH14111,"RADER, ELIZABETH ANNE",DEM,OH,14,"{2018,2020}",BETSY RADER FOR CONGRESS,C00637967
H8OH14129,"CARP, EVAN",REP,OH,14,"{2018,2020}",CARP FOR CONGRESS,C00639385
H8OH14137,"DIEMAND, LARRY L",DEM,OH,14,"{2018,2020}",LARRY DIEMAND FOR CONGRESS,C00639666
H8OH14145,"HICKEY, ADAM",GRE,OH,14,{2018},ADAM HICKEY FOR CONGRESSIONAL DISTRICT 14,C00648758
H8OH14152,"RAJIAH, JAMES",IND,OH,14,"{2018,2020}",JAMES RAJIAH FOR CONGRESS,C00674374
H8OH15126,"MILLER, JOHNATHAN WAYNE MR. JR",LIB,OH,15,{2018},COMMITTEE TO ELECT JOHNATHAN MILLER,C00639831
H8OH15134,"NEAL, RICK",DEM,OH,15,"{2018,2020}",RICK NEAL FOR CONGRESS,C00652651
H8OH16090,"GODFREY, AARON PAUL",DEM,OH,16,"{2018,2020}",GODFREY FOR CONGRESS,C00639567
H8OH16108,"HAGAN, CHRISTINA",REP,OH,16,"{2018,2020}",HAGAN FOR CONGRESS,C00638411
H8OH16116,"PATTON, THOMAS F.",REP,OH,16,{2018},PATTON FOR CONGRESS,C00652271
H8OH16124,"GONZALEZ, ANTHONY E",REP,OH,16,"{2018,2020}",ANTHONY GONZALEZ FOR CONGRESS,C00654079
H8OH16132,"SERYAK, KIT",REP,OH,16,{2018},KIT FOR CONGRESS,C00657791
H8OH16140,"DENT, MARK",DEM,OH,16,"{2018,2020}",MARK DENT FOR CONGRESS,C00660506
H8OH16157,"PALMER, SUSAN MORAN",DEM,OH,16,{2018},SUSAN MORAN PALMER FOR CONGRESS,C00667915
H8OH16173,"GOODRICH, GRANT G.",DEM,OH,16,{2018},GOODRICH FOR CONGRESS,C00666479
H8OH16181,"MULLOY, TJ",DEM,OH,16,"{2018,2020}",TJ MULLOY FOR CONGRESS,C00662080
H8OK01124,"COLEMAN, ANDY",REP,OK,1,"{2018,2020}",FRIENDS OF ANDY COLEMAN,C00630954
H8OK01132,"PENDLETON, SCOTT MR.",REP,OK,1,{2018},SCOTT PENDLETON FOR CONGRESS,C00630558
H8OK01140,"STOCKSTILL, DANNY",REP,OK,1,"{2018,2020}",DANNY STOCKSTILL FOR CONGRESS,C00632737
H8OK01157,"HERN, KEVIN R",REP,OK,1,"{2018,2020}",HERN FOR CONGRESS,C00636092
H8OK01165,"HARRIS, TIM",REP,OK,1,"{2018,2020}",FRIENDS OF TIM HARRIS,C00637777
H8OK01173,"GILPIN, TIM",DEM,OK,1,"{2018,2020}",GILPIN FOR CONGRESS 2018,C00672931
H8OK01181,"DOUGLAS, AMANDA",DEM,OK,1,"{2018,2020}",AMANDA DOUGLAS FOR CONGRESS 2018,C00674705
H8OK02130,"JACKSON, BRIAN KELLY",REP,OK,2,{2018},FRIENDS OF BRIAN JACKSON,C00647198
H8OK02148,"NICHOLS, JASON",DEM,OK,2,"{2018,2020}",JASON NICHOLS FOR CONGRESS,C00660977
H8OK02155,"PADGETT, DONALD CLAYTON",DEM,OK,2,{2018},"CLAY PADGETT FOR CONGRESS, LLC",C00670703
H8OK02163,"MCINTOSH, ELIJAH",DEM,OK,2,"{2018,2020}",ELIJAH MCINTOSH FOR CONGRESS,C00674853
H8OK02171,"POST, DYNDA ROSE",DEM,OK,2,{2018},DYNDA ROSE POST FOR CONGRESS,C00675892
H8OK02197,"CASTALDO, RICHARD MICHAEL",LIB,OK,2,"{2018,2020}",RICHARD CASTALDO FOR CONGRESS 2018,C00681791
H8OK03062,"THIBODEAUX, MURRAY MARK",DEM,OK,3,"{2018,2020}",FRIENDS OF MURRAY THIBODEAUX,C00668053
H8OK04060,"MCKENNA, JOHN W",DEM,OK,4,{2018},OKLAHOMANS FOR JOHN W. MCKENNA 2018,C00656454
H8OK04078,"GIPSON, FRED ALLEN",DEM,OK,4,"{2018,2020}",GIPSON 4 CONGRESS CAMPAIGN COMMITTEE,C00675405
H8OK04086,"KLUTTS, ROXANN M.",DEM,OK,4,"{2018,2020}",FRIENDS OF ROXANN KLUTTS,C00676825
H8OK04086,"KLUTTS, ROXANN M.",DEM,OK,4,"{2018,2020}",FRIENDS OF ROXANN KLUTTS 2018,C00676833
H8OK05091,"PORTER, EDDIE RAY",DEM,OK,5,{2018},"ED PORTER FOR CONGRESS, MAKE OKLAHOMA STRONG",C00635995
H8OK05109,"HORN, KENDRA",DEM,OK,5,"{2018,2020}",KENDRA HORN FOR CONGRESS,C00648915
H8OK05141,"FIELDS, GWENDOLYN",DEM,OK,1,"{2018,2020}",COMMITTEE TO ELECT GWENDOLYN FIELDS,C00669648
H8OK05190,"EDWARDS, DEJUAN",REP,OK,5,{2018},EDWARDS FOR OK 2018,C00678250
H8OR01213,"HOFER, RICHARD WILLIAM",NPA,OR,1,"{2018,2020}",RICHARD WILLIAM HOFER,C00667030
H8OR01221,"GRIFFITH, GEORGE",REP,OR,1,"{2018,2020}",GEORGE GRIFFITH ELECTION COMMITTEE,C00673699
H8OR02138,"WORDHOUSE, ROSS",DEM,OR,2,{2018},WORDHOUSE FOR CONGRESS,C00651380
H8OR02146,"WHITE, TIMOTHY",DEM,OR,2,{2018},TIMWHITEOREGONCD2,C00654145
H8OR02153,"BURNETTE, ERIC",DEM,OR,2,{2018},BURNETTE FOR CONGRESS,C00655514
H8OR02161,"MCLEOD-SKINNER, JAMIE",DEM,OR,2,"{2018,2020}",MCLEOD-SKINNER FOR OREGON,C00649004
H8OR02179,"NEAHRING, JENNIFER",DEM,OR,2,{2018},FRIENDS OF JENNIFER NEAHRING,C00660753
H8OR02187,"MASON, RAZ",DEM,OR,2,{2018},RAZ MASON FOR OREGON,C00669234
H8OR02229,"ROBERTS, MARK",IND,OR,2,"{2018,2020}",ROBERTS FOR CONGRESS,C00675645
H8OR03060,"BARNETT, CHARLES RAND",DEM,OR,3,"{2018,2020}",CHARLES RAND BARNETT US HOUSE CANDIDATE,C00664730
H8OR03102,"HARRISON, THOMAS S IV",REP,OR,3,"{2018,2020}",FRIENDS OF TOM HARRISON,C00684621
H8OR03102,"HARRISON, THOMAS S IV",REP,OR,3,"{2018,2020}",TOM HARRISON FOR CONGRESS,C00681387
H8OR04142,"BOICE, COURT",REP,OR,4,"{2018,2020}",FRIENDS OF COURT BOICE,C00677609
H8OR05198,"CALLAHAN, MARK ALLEN",REP,OR,5,"{2018,2020}",CALLAHAN FOR CONGRESS,C00651562
H8OR05206,"NATIONS, JOEY",REP,OR,5,"{2018,2020}",JOEY NATIONS FOR CONGRESS,C00672477
H8PA00023,"BROCK, RUEBEN",DEM,PA,0,"{2018,2020}",RUEBEN BROCK FOR CONGRESS,C00659649
H8PA01237,"AHMAD, NILOFER NINA",DEM,PA,1,{2018},NINA FOR CONGRESS,C00662205
H8PA01245,"LAWRENCE, MICHELE",DEM,PA,2,"{2018,2020}",MICHELE FOR CONGRESS,C00664060
H8PA01245,"LAWRENCE, MICHELE",DEM,PA,2,"{2018,2020}",PHILADELPHIA VOTERS UNITED,C00677542
H8PA01252,"SINGLETARY, WILLIE FLOYD",DEM,PA,3,"{2018,2020}",FRIENDS OF WILLIE SINGLETARY,C00665810
H8PA01260,"JOHNSON, KEVIN RAE MILES",DEM,PA,3,{2018},KEVIN JOHNSON FOR CONGRESS,C00665828
H8PA03118,"SKIBO, BRIAN",DEM,PA,3,"{2018,2020}",BRIAN SKIBO FOR CONGRESS,C00637595
H8PA03126,"RIEGER, CHRIS",DEM,PA,16,"{2018,2020}",CHRIS RIEGER FOR CONGRESS,C00649681
H8PA04090,"SCOTT, GEORGE",DEM,PA,10,"{2018,2020}",GEORGE SCOTT FOR CONGRESS,C00640961
H8PA04108,"CORBIN-JOHNSON, SHAVONNIA",DEM,PA,4,"{2018,2020}",PEOPLE FOR CORBIN-JOHNSON,C00657189
H8PA04116,"DEAN, MADELEINE",DEM,PA,4,"{2018,2020}",MAD4PA PAC,C00670844
H8PA04124,"LUDMIR, DANIEL",DEM,PA,4,{2018},LUDMIR FOR CONGRESS,C00671743
H8PA05204,"FRIEDENBERG, MARC",DEM,PA,12,"{2018,2020}",FRIENDS OF MARC FRIEDENBERG,C00655084
H8PA05212,"JODUN, WADE",DEM,PA,15,"{2018,2020}",THE CAMPAIGN TO ELECT WADE JODUN,C00664078
H8PA05220,"EBLE, JULIA ELLEN 6105589771",DEM,PA,5,{2018},JULIE EBLE FOR CONGRESS,C00670166
H8PA05246,"WERTIME, DAVID",DEM,PA,5,"{2018,2020}",FRIENDS OF DAVID WERTIME,C00670992
H8PA05253,"BADEY, GEORGE J. III",DEM,PA,5,{2018},GEORGE BADEY FOR CONGRESS,C00671404
H8PA05261,"ARATA, LARRY V MR. III",DEM,PA,5,"{2018,2020}",ELECT LARRY ARATA,C00670646
H8PA05279,"KIRKLAND, THADDEUS",DEM,PA,5,"{2018,2020}",KIRKLAND FOR CONGRESS,C00671867
H8PA05287,"DAVIDSON, MARGO",DEM,PA,5,{2018},MARGO FOR CONGRESS,C00671511
H8PA05295,"KIM, PEARL",REP,PA,5,"{2018,2020}",PEARL KIM FOR CONGRESS,C00673681
H8PA05303,"ADDIS, PAUL DAVID",REP,PA,5,{2018},ADDIS FOR PA,C00647594
H8PA06087,"HOULAHAN, CHRISSY",DEM,PA,6,"{2018,2020}",CHRISSY HOULAHAN FOR CONGRESS,C00637371
H8PA06095,"MASTERS, PAUL MICHAEL DREXEL UNI JR",REP,PA,6,"{2018,2020}",COMMITTEE TO ELECT PAUL MASTERS,C00666651
H8PA07093,"MCGINTY, JOHN",DEM,PA,7,"{2018,2020}",MCGINTY FOR CONGRESS,C00630590
H8PA07101,"MUROFF, DANIEL",DEM,PA,5,"{2018,2020}",FRIENDS OF DAN MUROFF,C00636563
H8PA07119,"SHEEHAN, MOLLY",DEM,PA,5,{2018},SHEEHAN FOR CONGRESS,C00637223
H8PA07127,"MORO, ELIZABETH RHEIN",DEM,PA,6,{2018},ELIZABETH MORO FOR CONGRESS,C00637991
H8PA07135,"BILLIE, JOSEPH MICHAEL",REP,PA,5,"{2018,2020}",JOE BILLIE FOR CONGRESS,C00639765
H8PA07143,"PERRY, PAUL-DAVID II",DEM,PA,7,{2018},PERRY FOR PENNSYLVANIA,C00641027
H8PA07168,"CHAUNCEY, SHELLY WILSON",DEM,PA,5,"{2018,2020}",SHELLY CHAUNCEY FOR CONGRESS,C00666438
H8PA07176,"VITALI, GREG",DEM,PA,7,{2018},VITALI FOR CONGRESS,C00667295
H8PA07184,"LUNKENHEIMER, ASHLEY",DEM,PA,5,{2018},ASHLEY LUNKENHEIMER FOR CONGRESS,C00669481
H8PA07192,"MCCAULEY, GREGORY MICHAEL",REP,PA,6,"{2018,2020}",GREG MCCAULEY FOR CONGRESS,C00668400
H8PA07200,"SCANLON, MARY GAY",DEM,PA,5,"{2018,2020}",SCANLON FOR CONGRESS,C00669358
H8PA07200,"SCANLON, MARY GAY",DEM,PA,5,"{2018,2020}",SCANLON FOR VICTORY FUND,C00688051
H8PA07218,"POZOS, CLARE PUTNAM",REP,PA,7,{2018},CLARE FOR CONGRESS,C00669432
H8PA07226,"BOYLE, DANIEL",DEM,PA,5,"{2018,2020}",DAN BOYLE FOR CONGRESS,C00669457
H8PA07234,"CRAIG, CHRISTINE E",DEM,PA,7,"{2018,2020}",FRIENDS OF CHRISTINE CRAIG,C00670901
H8PA07242,"RUGGLES, ROGER WILLIAM DR.",DEM,PA,7,{2018},COMMITTEE TO ELECT ROGER RUGGLES,C00674390
H8PA07275,"SILIFIES, TIM",LIB,PA,7,{2018},TIM SILFIES FOR CONGRESS,C00675710
H8PA07309,"SHUPE, LEWIS ARTHUR",IND,PA,7,"{2018,2020}",FRIENDS OF LEWIS SHUPE,C00690859
H8PA08141,"REDDICK, RACHEL",DEM,PA,1,{2018},REDDICK FOR CONGRESS,C00657486
H8PA08158,"MIHALEK, VALERIE L",REP,PA,1,{2018},MIHALEK FOR CONGRESS,C00658138
H8PA08166,"BACHER, STEVE",DEM,PA,1,{2018},FRIENDS OF STEVE BACHER,C00664524
H8PA08174,"WALLACE, HENRY SCOTT",DEM,PA,1,"{2018,2020}",SCOTT WALLACE FOR CONGRESS,C00667097
H8PA09024,"EICHELBERGER, JOHN H. JR.",REP,PA,13,"{2018,2020}",EICH FOR CONGRESS,C00666529
H8PA09032,"REED, DAVE",REP,PA,9,"{2018,2020}",DAVE REED FOR CONGRESS,C00666883
H8PA09040,"MERRILL, MAXIMILIAN",REP,PA,9,{2018},RURAL PENNSYLVANIANS FOR MAX MERRILL,C00668319
H8PA09057,"MASTRIANO, DOUGLAS PH.D. COL PH.D",REP,PA,13,{2018},MASTRIANO FOR CONGRESS,C00667931
H8PA09065,"BOSER, SUSAN",DEM,PA,15,"{2018,2020}",FRIENDS OF SUSAN BOSER,C00670364
H8PA09073,"HALCOVAGE, GEORGE F. JR.",REP,PA,9,"{2018,2020}",GEORGE HALCOVAGE FOR CONGRESS,C00673558
H8PA09081,"QUICK, LAURA",DEM,PA,9,"{2018,2020}",LAURA QUICK FOR CONGRESS,C00654558
H8PA10162,"MCDADE, MARK PETER",DEM,PA,10,{2018},MCDADE FOR CONGRESS,C00638593
H8PA10170,"HERSCHEL, JUDITH L",DEM,PA,10,"{2018,2020}",SUPPORTERS OF JUDY HERSCHEL,C00648618
H8PA10188,"MCLINKO, DOUG",REP,PA,12,"{2018,2020}",DOUG MCLINKO FOR CONGRESS,C00661900
H8PA10196,"STILP, GENE",DEM,PA,10,{2018},GENE STILP FOR CONGRESS 2018,C00670638
H8PA10204,"FEIGL-DING, ERIC",DEM,PA,10,"{2018,2020}",COMMITTEE TO ELECT ERIC DING,C00671107
H8PA10212,"KEELER, JONATHAN DAVID MR.",DEM,PA,10,{2018},KEELER FOR CONGRESS,C00671586
H8PA11053,"HOWE, ROBERT ALAN",DEM,PA,10,"{2018,2020}",HOWE FOR PA 10,C00639955
H8PA11053,"HOWE, ROBERT ALAN",DEM,PA,10,"{2018,2020}",NEPA FOR HOWE,C00665943
H8PA11061,"BLOOM, STEPHEN",REP,PA,13,{2018},BLOOM FOR CONGRESS,C00652735
H8PA11087,"LEWIS, ANDREW",REP,PA,11,{2018},FRIENDS OF ANDREW LEWIS,C00657320
H8PA11095,"WOLFF, DENNY",DEM,PA,9,"{2018,2020}",DENNY WOLFF FOR CONGRESS,C00658328
H8PA11103,"PETERS, JOE",REP,PA,8,{2018},CITIZENS FOR JOE PETERS,C00665059
H8PA11111,"BEILER, CHET",REP,PA,11,"{2018,2020}",CHET BEILER FOR CONGRESS,C00675157
H8PA11129,"LASALA, MICHAEL THOMAS MR.",IND,PA,11,"{2018,2020}",LASALA FOR CONGRESS,C00678219
H8PA12069,"PRIGG, THOMAS LEE",DEM,PA,14,"{2018,2020}",TOM PRIGG FOR CONGRESS,C00634139
H8PA12077,"ANTHONY, AARON",DEM,PA,12,{2018},AARON ANTHONY FOR CONGRESS,C00636555
H8PA12085,"TARASI, ELIZABETH M",DEM,PA,17,{2018},TARASI FOR CONGRESS,C00639005
H8PA12093,"STOLZ, JOHN",DEM,PA,12,{2018},STOLZ FOR CONGRESS,C00651356
H8PA12101,"LINSENMAYER, RAYMOND",DEM,PA,17,"{2018,2020}",FRIENDS OF RAY LINSENMAYER,C00661066
H8PA13109,"HART, KRISTOPHER",REP,PA,13,"{2018,2020}",KRIS HART FOR CONGRESS,C00655126
H8PA13117,"GOODMAN, SHIRA MS.",DEM,PA,4,{2018},FRIENDS OF SHIRA GOODMAN,C00667840
H8PA13125,"JOYCE, JOHN",REP,PA,13,"{2018,2020}",DR JOHN JOYCE FOR CONGRESS,C00674259
H8PA13133,"OTTAWAY, BRENT M",DEM,PA,13,"{2018,2020}",BRENT OTTAWAY FOR CONGRESS,C00674887
H8PA13141,"WASHABAUGH, BERNARD II",REP,PA,13,"{2018,2020}",WASHABAUGH FOR CONGRESS COMMITTEE,C00677765
H8PA14065,"BOERIO, BIBIANA",DEM,PA,14,"{2018,2020}",BOERIO FOR CONGRESS,C00675041
H8PA15161,"LEINER, WILLIAM JR.",DEM,PA,15,"{2018,2020}",FRIENDS OF BILL LEINER,C00640409
H8PA15179,"SIMMONS, JUSTIN JAY",REP,PA,15,{2018},JUSTIN SIMMONS FOR CONGRESS,C00654848
