candidate_id,name.x,party,state,district,cycles,name.y,committee_id
H0AL03192,"THOMPSON, HANNAH",DEM,AL,3,"{2018,2020}",H THOMPSON 4 CONGRESS,C00681452
H0AL06104,"ALLEN, ANDERS POPE",REP,AL,6,"{2018,2020}",ANDERS POPE ALLEN COMMITTEE,C00681213
H0CA04167,"FRAME, SEAN COLIN",DEM,CA,4,"{2018,2020}",SEAN FRAME FOR CONGRESS,C00691790
H0CA32333,"GONZALES, EMANUEL LAWRENCE MR",DEM,CA,32,"{2018,2020}",EMANUEL GONZALES COMMITTEE TO ELECT FOR CONGRESS,C00685743
H0CA50095,"RAHN, MATT DR.",REP,CA,50,"{2018,2020}",MATT RAHN FOR CONGRESS,C00691675
H0FL04124,"DEPAUL, MONICA PAIGE",DEM,FL,4,"{2018,2020}",MONICA 4 FLORIDA,C00635136
H0FL18173,"VAUGHN, KAREN",RE,FL,18,"{2018,2020}",KAREN VAUGHN FOR CONGRESS,C00675116
H0FL22050,"REYES, OMAR",IND,FL,22,"{2018,2020}",OMAR2020,C00689554
H0FL23041,"OLIVO, CHRISTINE ALEXANDRIA 1983",DEM,FL,23,"{2018,2020}",CHRISTINE FOR CONGRESS,C00691832
H0FL23058,"NIZAHON, SHLOMO",REP,FL,23,"{2018,2020}",NIZAHON FOR CONGRESS,C00692533
H0GA06143,"BHUIYAN, MOHAMMAD ALI",REP,GA,6,{2018},MOHAMMAD ALI BHUIYAN FOR CONGRESS,C00633529
H0GA06150,"HARRISON, JAYLA",CMD,GA,6,"{2018,2020}",JAYLA HARRISON,C00689646
H0MD06231,"PARROTT, NEIL CONRAD MR.",REP,MD,6,"{2018,2020}",PARROTT FOR CONGRESS,C00691931
H0MI03233,"RAFI, EMILY E.",DEM,MI,3,"{2018,2020}",THE COMMITTEE TO ELECT EMILY RAFI,C00692830
H0MI11095,"KELLER, SCOTT THOMAS 12/01/2015",REP,MI,11,"{2018,2020}",COMMITTEE TO ELECT SCOTT KELLER,C00691535
H0NY03059,"WEINSTOCK, MICHAEL S",DEM,NY,3,"{2018,2020}",FRIENDS OF MICHAEL WEINSTOCK,C00691709
H0NY15152,"ORTIZ, JONATHAN",DEM,NY,15,"{2018,2020}",ORTIZ FOR CONGRESS,C00692012
H0PA07132,"HENDRICKS, DARRYL P",DEM,PA,7,"{2018,2020}",HENDRICKS 2020,C00695106
H0PA09039,"HORNBERGER, BENJAMIN DAYTON",REP,PA,9,"{2018,2020}",FRIENDS OF BEN HORNBERGER,C00657064
H0SC07011,"HUGGINS, DEWON",REP,SC,7,"{2018,2020}",DEWON HUGGINS FOR US CONGRESS SC-07,C00692053
H0SD01060,"SPAWN, ELLEE",DEM,SD,0,"{2018,2020}",ELLEE SPAWN FOR SOUTH DAKOTA,C00691519
H0TX07154,"DEVOR, THOMAS CHRISTIAN MR.",REP,TX,7,"{2018,2020}",DEVOR FOR CONGRESS,C00691592
H0TX09168,"MENEFEE, JON MARK MR",REP,TX,9,"{2018,2020}",MENEFEE FOR CONGRESS,C00683656
H0TX18243,"PATEL, BIMAL DR.",DEM,TX,18,"{2018,2020}",BIMAL FOR CONGRESS,C00692061
H0TX22153,"WALZ, THADDEUS JOSEPH",REP,TX,22,"{2018,2020}",COMMITTEE TO ELECT JOE WALZ,C00693176
H0TX23144,"WAHL, LIZ DOMINGO",DEM,TX,23,"{2018,2020}",LIZ WAHL FOR TX-23,C00693135
H0TX24142,"KUZMICH, STEPHEN",IND,TX,24,"{2018,2020}",KUZMICH FOR CONGRESS,C00691758
H0TX31030,"GARAPATI, ABHIRAM",REP,TX,31,"{2018,2020}",ABHIRAM FOR CONGRESS,C00693051
H0VA10152,"ABDALLAH, UNIT89487",W,VA,10,"{2018,2020}",SUPERINTELLIGENCE FOR ALL,C00691386
H0WI03092,"VIRIJEVICH, ALEX WILLIAM MR",REP,WI,3,"{2018,2020}",VIRIJEVICH FOR WISCONSIN 2018,C00637686
H2NY06165,"FUENTES-PADILLA, CHRISTOPHER ROBBIN MR.",LIB,NY,6,"{2018,2020}",CHRISTOPHER PADILLA FOR CONGRESS,C00654046
H2NY21115,"NELSON, PATRICK F",DEM,NY,21,"{2018,2020}",NELSON FOR NEW YORK,C00631127
H2TX16227,"TILGHMAN, JEROME LEANDER",DEM,TX,16,"{2012,2018}",TILGHMAN FOR CONGRESS,C00660415
H4IN02150,"CARPENTER, DOUGLAS M.",DEM,IN,2,"{2014,2016,2018,2020}",CARPENTER FOR CONGRESS,C00640730
H4MN08091,"SANDMAN, RAY HENRY JOHN (SKIP)",IND,MN,8,"{2014,2018,2020}",SKIP SANDMAN CAMPAIGN COMMITTEE,C00665125
H4WI04241,"GEORGE, GARY R.",DEM,WI,4,"{2014,2016,2018,2020}",GARYGEORGE4CONGRESS,C00683938
H6CA01202,"PETERSON, DAVID",DEM,CA,1,"{2016,2018,2020}",PETERSON FOR CONGRESS,C00672923
H6LA01225,"KEARNEY, HOWARD",LIB,LA,1,"{2016,2018}",KEARNEY FOR CONGRESS 2018,C00675835
H6MO07235,"LOMBARDI-OLIVE, CAMILLE",REP,MO,1,"{2016,2018,2020}",CAMILLE FOR CONGRESS HEART OF MISSOURI,C00674820
H6OH02292,"EVERHARD, JANET",DEM,OH,2,"{2016,2018}",COMMITTEE TO ELECT JANET EVERHARD,C00635102
H6OK02258,"MCCARTHY, JOHN",REP,OK,2,"{2016,2018}",MCCARTHY FOR CONGRESS,C00655555
H6OR02181,"CRARY, JAMES ""JIM""",DEM,OR,2,"{2016,2018}",CRARY FOR CONGRESS,C00634659
H6TN08250,"STOTTS-PEARSON, ERIKA",DEM,TN,8,"{2016,2018,2020}",ERIKA STOTTS PEARSON FOR CONGRESS,C00684977
H8AK00132,"SHEIN, DIMITRI",DEM,AK,0,"{2018,2020}",DIMITRI FOR CONGRESS,C00646521
H8AK00140,"GALVIN, ALYSE",IND,AK,0,"{2018,2020}",ALYSE FOR ALASKA,C00665711
H8AK01015,"FITCH, GREGORY FITCH MR",NPA,AK,0,"{2018,2020}",WE ARE IN FOR FITCH,C00649319
H8AK01023,"HAFNER, CAROL",DEM,AK,0,"{2018,2020}",CAROL HAFNER FOR CONGRESS,C00679621
H8AK01031,"NELSON, THOMAS JOHN",REP,AK,0,"{2018,2020}",JOHN NELSON FOR ALASKANS,C00681155
H8AL01066,"KENNEDY, ROBERT JR.",DEM,AL,1,"{2018,2020}","COMMITTEE TO ELECT ROBERT KENNEDY, JR. FOR U.S. CONGRESS",C00667949
H8AL01074,"ARRAS, JENNIFER O'FARRILL MRS.",DEM,AL,1,"{2018,2020}",FRIENDS OF JENNY ARRAS,C00668996
H8AL01082,"MCCONNELL, LIZZETTA HILL",DEM,AL,1,{2018},COMMITTEE TO ELECT LIZZETTA MCCONNELL FOR CONGRESS,C00678037
H8AL02163,"WILLIAMS, AUDRI SCOTT 1955",DEM,AL,2,"{2018,2020}",COMMITTEE TO ELECT AUDRI SCOTT WILLIAMS,C00650390
H8AL02171,"MOORE, FELIX BARRY",REP,AL,2,"{2018,2020}",BARRY MOORE FOR CONGRESS,C00639096
H8AL02189,"AMASON, THOMAS MARRION III",REP,AL,2,"{2018,2020}",TOMMY AMASON FOR CONGRESS,C00651661
H8AL02197,"ISNER, TABITHA KAY",DEM,AL,2,"{2018,2020}",FRIENDS OF TABITHA ISNER,C00657437
H8AL02205,"HOBSON, RICH",REP,AL,2,{2018},RICH HOBSON FOR CONGRESS,C00664482
H8AL02213,"BRIGHT, BOBBY NEAL SR.",REP,AL,2,{2018},BOBBY BRIGHT FOR CONGRESS,C00669580
H8AL03054,"HAGAN, MALLORY",DEM,AL,3,"{2018,2020}",MALLORY HAGAN FOR CONGRESS,C00668574
H8AL03062,"WINFREY, ADIA MCCLELLAN DR",DEM,AL,3,"{2018,2020}",COMMITTEE TO ELECT DR. ADIA WINFREY,C00669010
H8AL04060,"NORRIS, PHILLIP",REP,AL,4,{2018},PHIL NORRIS FOR CONGRESS,C00636241
H8AL04078,"MOSES, MIKE",REP,AL,4,"{2018,2020}",COMMITTEE TO ELECT MIKE MOSES,C00647909
H8AL04086,"NEIGHBORS, RICKY ALLEN",DEM,AL,4,{2018},RICK NEIGHBORS FOR CONGRESS,C00648329
H8AL04094,"AUMAN, JAMES LEE",DEM,AL,4,{2018},LEE AUMAN FOR UNITED STATES CONGRESS,C00665182
H8AL04102,"BLACKMON, ANTHONY MR",REP,AL,4,"{2018,2020}",ANTHONY BLACKMON FOR CONGRESS,C00667352
H8AL05174,"CAIN, BRETT BUTLER",DEM,AL,5,{2018},BUTLER CAIN FOR CONGRESS,C00640011
H8AL05182,"SWEENEY, TERRENCE MICHAEL",REP,AL,5,{2018},MICHAEL SWEENEY FOR CONGRESS COMMITTEE,C00651927
H8AL05190,"JOFFRION, PETER S.",DEM,AL,5,"{2018,2020}",PETER JOFFRION FOR CONGRESS,C00647677
H8AL05208,"HINCHMAN, ROBERT CLAYTON MR",GOP,AL,5,"{2018,2020}",HINCHMAN FOR CONGRESS,C00648162
H8AL05216,"HOLTZCLAW, WILLIAM LOVETTE",REP,AL,5,{2018},HOLTZCLAWFORCONGRESS.COM,C00653691
H8AL06099,"KLINE, DANNER",DEM,AL,6,"{2018,2020}",FRIENDS OF DANNER KLINE,C00638536
H8AL07089,"RICE, RICHARD BRAND NEW",DEM,AL,7,"{2018,2020}",RICHARD RICE 2018,C00640144
H8AL88014,"MAY, JUSTIN TYLER MR.",DEM,AL,88,"{2018,2020}",THE COMMITTEE TO ELECT TYLER MAY,C00663575
H8AR01029,"DESAI, CHINTAN",DEM,AR,1,{2018},CHINTAN DESAI FOR CONGRESS,C00661371
H8AR02126,"BURCH, NATASHIA",IND,AR,2,"{2018,2020}",UNITED FOR BURCH HULSEY,C00640128
H8AR02134,"SPENCER, PAUL JOHN MR.",DEM,AR,2,"{2018,2020}",PAUL SPENCER FOR CONGRESS,C00648741
H8AR02142,"COMBS, GWENDOLYNN MILLEN MRS.",DEM,AR,2,"{2018,2020}",COMBS FOR ARKANSAS,C00652289
H8AR02159,"TUCKER, EVERETT CLARKE IV",DEM,AR,2,"{2018,2020}",CLARKE TUCKER FOR CONGRESS,C00671156
H8AR02167,"DUNKLEY, JONATHAN",DEM,AR,2,{2018},JONATHAN DUNKLEY FOR CONGRESS,C00668830
H8AR03066,"RYERSE, ROBERT",REP,AR,3,"{2018,2020}",ROBERT RYERSE 2018,C00639849
H8AR03074,"MAHONY, JOSH",DEM,AR,3,"{2018,2020}",JOSH MAHONY FOR CONGRESS,C00650093
H8AR04114,"BARRETT, MICHAEL",LIB,AR,4,{2018},COMMITTEE TO ELECT MICHAEL BARRETT,C00652032
H8AR04122,"MCQUEEN, LEE",IND,AR,4,{2018},MCQUEEN4CONGRESS,C00658898
H8AR04130,"SHAMEL, HAYDEN CATHERINE",DEM,AR,4,"{2018,2020}",HAYDEN SHAMEL FOR ARKANSAS,C00659235
H8AR04148,"CALDWELL, RANDY",REP,AR,4,"{2018,2020}",RANDY CALDWELL FOR CONGRESS,C00675744
H8AR04155,"MARTIN, SUSANANN",W,AR,4,"{2018,2020}",SUSANANN FOR CONGRESS,C00671529
H8AZ01211,"CAVANAUGH, KEVIN",REP,AZ,1,"{2018,2020}",CAVANAUGH FOR CONGRESS,C00634824
H8AZ01229,"SMITH, STEVE",REP,AZ,1,"{2018,2020}",STEVE SMITH FOR CONGRESS,C00641431
H8AZ01237,"SHEDD, TIFFANY",REP,AZ,1,"{2018,2020}",TIFFANY SHEDD FOR CONGRESS COMMITTEE,C00657155
H8AZ02102,"FOSTER, WILLIAM ABBOTT PHD",DEM,AZ,2,{2018},WILL FOSTER 4 CONGRESS,C00635623
H8AZ02110,"KOVACS, WILLIAM RICHARD",DEM,AZ,2,"{2018,2020}",BILLY KOVACS FOR CONGRESS,C00636175
H8AZ02128,"VERDIN, CHARLIE",DEM,AZ,2,"{2018,2020}",CHARLIE VERDIN FOR CONGRESS,C00636423
H8AZ02136,"HEINZ, MATTHEW GERALD",DEM,AZ,2,"{2018,2020}",DR MATT HEINZ FOR ARIZONA,C00647727
H8AZ02144,"MATIELLA, MARIA MARY",DEM,AZ,2,{2018},MATIELLA FOR CONGRESS,C00648014
H8AZ02169,"WHEELER, BRUCE",DEM,AZ,2,"{2018,2020}",WHEELER FOR CONGRESS,C00653238
H8AZ02177,"SHERRY, BARBARA LOUISE",DEM,AZ,2,{2018},BARBARASHERRYFORCONGRESS,C00658054
H8AZ02185,"MARQUEZ PETERSON, LEA",REP,AZ,2,"{2018,2020}",LEA MARQUEZ PETERSON FOR CONGRESS,C00663054
H8AZ02193,"WELCH, CASEY BURKE MR.",REP,AZ,2,{2018},CASEYWELCHFORCONGRESS,C00667287
H8AZ02201,"MARTIN, BRANDON RAY",REP,AZ,2,"{2018,2020}",MARTIN FOR FREEDOM,C00668285
H8AZ02219,"WILES, MARILYN MS",REP,AZ,2,"{2018,2020}",MARILYN WILES FOR CONGRESS,C00669572
H8AZ02227,"MORALES, DANIEL ROMERO JR",REP,AZ,2,"{2018,2020}",MORALES FOR CONGRESS,C00670224
H8AZ02235,"YUKSEL, YAHYA",DEM,AZ,2,"{2018,2020}",YAHYA4CONGRESS,C00671875
H8AZ03142,"ARELLANO, SERGIO",REP,AZ,3,"{2018,2020}",ARELLANO FOR ARIZONA,C00663245
H8AZ03159,"PIERSON, JOE NICOLAS",REP,AZ,3,"{2018,2020}",PIERSON FOR CONGRESS,C00666107
H8AZ03175,"EVANS, PAUL MURRAY",REP,AZ,3,"{2018,2020}",PAUL EVANS CANDIDATE COMMITTEE,C00673376
H8AZ04132,"PEREZ GISSY, ANA MARIA MS",DEM,AZ,4,"{2018,2020}",ANA MARIA PEREZ FOR CONGRESS,C00651620
H8AZ04140,"BRILL, DAVID H",DEM,AZ,4,"{2018,2020}",BRILL FOR CONGRESS,C00664342
H8AZ04140,"BRILL, DAVID H",DEM,AZ,4,"{2018,2020}",DAVID BRILL FOR CONGRESS COMMITTEE,C00664359
H8AZ04157,"ANDRESKI, THADDEUS J MR. II",W,AZ,4,{2018},THAD ANDRESKI II AZCD4,C00667535
H8AZ04165,"DISANTO, DELINA",DEM,AZ,4,"{2018,2020}",DELINA DISANTO FOR CONGRESS,C00672154
H8AZ05154,"GREENE, JOAN",DEM,AZ,5,"{2018,2020}",JOAN GREENE FOR CONGRESS,C00640938
H8AZ05162,"TORRES, JOSE LAZARO",DEM,AZ,5,"{2018,2020}",FRIENDS OF JOSE TORRES,C00661686
H8AZ05170,"MARGALIS, TONY",DEM,AZ,5,{2018},TONY MARGALIS FOR CONGRESS,C00665224
H8AZ06087,"MCFADDEN, GARRICK ARVIN MR.",DEM,AZ,6,{2018},GARRICK MCFADDEN FOR CONGRESS,C00638262
H8AZ06095,"ROSS, HEATHER MAURA",DEM,AZ,6,{2018},HEATHER ROSS FOR CONGRESS,C00651752
H8AZ06103,"MALIK, ANITA",DEM,AZ,6,"{2018,2020}",ANITA FOR ARIZONA,C00655134
H8AZ06111,"JETTE, MATT DR.",DEM,AZ,6,"{2018,2020}",JETTE FOR US,C00673566
H8AZ06111,"JETTE, MATT DR.",DEM,AZ,6,"{2018,2020}",JETTE FOR US CONGRESS,C00673640
H8AZ07044,"MIRANDA, CATHERINE",DEM,AZ,7,"{2018,2020}",MIRANDA FOR ARIZONA,C00664490
H8AZ08059,"WESTBROOK, BRIANNA",DEM,AZ,8,{2018},BRIANNA WESTBROOK FOR CONGRESS,C00634188
H8AZ08067,"MCHALE, JUDITH KEENAN",DEM,AZ,8,"{2018,2020}",JUDITH MCHALE FOR CONGRESS,C00635730
H8AZ08075,"BEYER, AUGUSTINE BEYER",NNE,AZ,8,"{2018,2020}",COMMITTEE TO ELECT AUGIE BEYER,C00648873
H8AZ08083,"TIPIRNENI, HIRAL",DEM,AZ,8,"{2018,2020}",HIRAL FOR CONGRESS,C00649897
H8AZ08091,"SYLVESTER, CHRISTOPHER",IND,AZ,8,"{2018,2020}",SYLVESTER FOR ARIZONA,C00657627
H8AZ08109,"LIEN, DAVID",REP,AZ,8,"{2018,2020}",DAVID LIEN FOR CONGRESS,C00662460
H8AZ08133,"LOVAS, PHIL",REP,AZ,8,{2018},LOVAS FOR CONGRESS,C00663203
H8AZ08141,"ALLEN, CHAD",REP,AZ,8,{2018},CHAD ALLEN FOR CONGRESS,C00663757
H8AZ08158,"LESKO, DEBBIE",REP,AZ,8,"{2018,2020}",DEBBIE LESKO FOR CONGRESS,C00663914
H8AZ08166,"BAKER, SCOTT ALLEN 1972",REP,AZ,8,"{2018,2020}",BAKER FOR CONGRESS 2018,C00664003
H8AZ08174,"MONTENEGRO, STEVE",REP,AZ,8,{2018},MONTENEGRO FOR CONGRESS,C00664813
H8AZ08182,"DILLEY, BRENDEN",REP,AZ,8,{2018},DILLEY FOR CONGRESS,C00663351
H8AZ08190,"MACK, RICHARD",REP,AZ,8,{2018},SHERIFF RICHARD MACK FOR CONGRESS INC.,C00664953
H8AZ08208,"SAWDY, STEVEN",REP,AZ,8,{2018},SAWDY FOR ARIZONA,C00666867
H8AZ08232,"MUSSELWHITE, ROBERT RICHARD",DEM,AZ,8,"{2018,2020}",BOB MUSSELWHITE FOR CONGRESS,C00673194
H8AZ08240,"OLSEN, ROBERT DEAN",DEM,AZ,8,"{2018,2020}",BOBOLSENIN 2018,C00676122
H8AZ08257,"DOWLING, SANDRA ELAINE DR",REP,AZ,8,{2018},DOWLING FOR CONGRESS,C00679993
H8AZ09016,"BARONESS VON BEHR, IRINA",REP,AZ,9,"{2018,2020}",IRINA BARONESS VON BEHR FOR US CONGRESS,C00634337
H8AZ09024,"FERRARA, STEVE MD",REP,AZ,9,{2018},STEVE FERRARA FOR CONGRESS,C00640268
H8AZ09032,"LEIBSOHN, SETH MR.",REP,AZ,9,"{2018,2020}",SETH LEIBSOHN FOR CONGRESS,C00656603
H8AZ09040,"STANTON, GREG",DEM,AZ,9,"{2018,2020}",STANTON FOR CONGRESS,C00657304
H8AZ09057,"MENOR, SCOTT A",DEM,AZ,5,{2018},COMMITTEE TO ELECT SCOTT MENOR,C00657403
H8AZ09065,"ARAUJO, HECTOR MR.",DEM,AZ,9,"{2018,2020}",HECTOR FOR ARIZONA,C00676015
H8CA01190,"HOLCOMBE, JESSICA JONES",DEM,CA,1,{2018},JESSICA HOLCOMBE FOR CONGRESS,C00639799
H8CA01208,"WALTERS, MARTHA",DEM,CA,1,{2018},MARTY WALTERS FOR CONGRESS,C00639732
H8CA01216,"STORMENT, BRANDON",DEM,CA,1,{2018},BRANDON STORMENT FOR CONGRESS,C00647032
H8CA01224,"DUNCAN, DENNIS DEAN",DEM,CA,1,{2018},DENNIS DUNCAN FOR CONGRESS,C00635961
H8CA01240,"ELBINGER, LEWIS",GRE,CA,1,{2018},LEWIS ELBINGER FOR CONGRESS,C00664912
H8CA01257,"DENNEY, AUDREY L",DEM,CA,1,"{2018,2020}",AUDREY DENNEY FOR CONGRESS,C00664409
H8CA03170,"PUETT, KEVIN",DEM,CA,3,"{2018,2020}",PUETT FOR CONGRESS,C00673186
H8CA04186,"WILCOX, ROCHELLE LYN",DEM,CA,4,{2018},ROCHELLE WILCOX FOR CONGRESS,C00639906
H8CA04194,"BATESON, REGINA",DEM,CA,4,{2018},BATESON FOR CONGRESS,C00639211
H8CA04202,"CALDERON, ROZA I",DEM,CA,4,"{2018,2020}",ROZA CALDERON FOR CONGRESS 2018,C00640755
H8CA04210,"MORSE, JESSICA",DEM,CA,4,"{2018,2020}",JESSICA MORSE FOR CONGRESS,C00650408
H8CA04236,"WHITE, MITCHELL",REP,CA,4,"{2018,2020}",VOTE MITCHELL WHITE,C00666693
H8CA04244,"LAWTON, ROBERT",DEM,CA,4,{2018},LAWTON FOR CONGRESS 2018,C00673087
H8CA06090,"JEFFERSON, JRMAR",DEM,CA,6,"{2018,2020}",JEFFERSON FOR CONGRESS,C00684753
H8CA07056,"GRANT, ANDREW",REP,CA,7,"{2018,2020}",ANDREW GRANT FOR CONGRESS,C00649400
H8CA07064,"WESTMORELAND, BRAD",DEM,CA,7,{2018},BRAD WESTMORELAND FOR CONGRESS,C00653097
H8CA07072,"BARASH, YONA",REP,CA,7,{2018},YONA BARASH FOR CONGRESS,C00655191
H8CA07080,"RICHARDSON, ROBERT CHRISTIAN",GRE,CA,7,"{2018,2020}",RICHARDSON4CONGRESS2018,C00664946
H8CA08096,"O'DONNELL, RONALD",DEM,CA,8,"{2018,2020}",ODONNELL4CALIFORNIA 2018,C00636274
H8CA08104,"BROWN, YOLANDA",DEM,CA,8,{2018},YOLANDA BROWN FOR CONGRESS,C00654905
H8CA08112,"DOYLE, MARGE",DEM,CA,8,"{2018,2020}",MARGE DOYLE FOR CONGRESS,C00657122
H8CA08120,"DONNELLY, TIMOTHY M.",REP,CA,8,"{2018,2020}",TIM DONNELLY FOR CONGRESS,C00658021
H8CA09144,"LIVENGOOD, MARLA",REP,CA,9,"{2018,2020}",MARLA LIVENGOOD FOC CONGRESS,C00660852
H8CA10100,"BEDOLLA, MATEO MORELOS",DEM,CA,10,{2018},MATEO M. BEDOLLA FOR CONGRESS,C00638569
H8CA10118,"NYGARD, DOROTHY (DOTTY)",DEM,CA,10,{2018},DOTTY NYGARD FOR CONGRESS,C00638783
H8CA10126,"HARDER, JOSH",DEM,CA,10,"{2018,2020}",JOSH HARDER FOR CONGRESS,C00639146
H8CA10134,"BATTISTA, LISA",DEM,CA,10,"{2018,2020}",LISA BATTISTA FOR CONGRESS,C00641092
H8CA10142,"SNOVER, TERRA EVA",IND,CA,10,"{2018,2020}",VOTE TERRA SNOVER,C00647156
H8CA10159,"VAUGHN, SETH MICHAEL",DEM,CA,10,{2018},SETH VAUGHN FOR CONGRESS,C00648592
H8CA10167,"COX, TERRANCE JOHN (TJ)",DEM,CA,21,"{2018,2020}",TJ COX FOR CONGRESS,C00648956
H8CA10175,"MADUENO, VIRGINIA",DEM,CA,10,"{2018,2020}",VIRGINIA FOR CONGRESS,C00653576
H8CA10183,"ZWAHLEN, SUE",DEM,CA,10,{2018},SUE ZWAHLEN FOR CONGRESS,C00653840
H8CA10191,"SHOBLOM, SCOTT",IND,CA,10,{2018},FRIENDS & SUPPORTERS SCOTT SHOBLOM FOR CONGRESS,C00660266
H8CA10209,"HOWZE, TED D II",REP,CA,10,"{2018,2020}",TED HOWZE FOR CONGRESS 2020,C00681544
H8CA11090,"LYTTON, ALVA",DEM,CA,11,"{2018,2020}",COMMITTEE TO ELECT DENNIS LYTTON,C00662437
H8CA12239,"JAFFE, STEPHEN R",DEM,CA,12,"{2018,2020}",COMMITTEE TO ELECT STEPHEN R JAFFE; THE,C00638775
H8CA12254,"KHOJASTEH, RYAN",DEM,CA,12,{2018},KHOJASTEH FOR A CHANGED CONGRESS,C00658534
H8CA12262,"BUTTAR, SHAHID",DEM,CA,12,"{2018,2020}",SHAHID BUTTAR FOR CONGRESS COMMITTEE,C00670463
H8CA12270,"REMMER, LISA",REP,CA,12,{2018},REMMER FOR CONGRESS,C00672980
H8CA12296,"GOLDSTEIN, MICHAEL",NOP,CA,12,{2018},COMMITTEE TO ELECT MICHAEL GOLDSTEIN,C00675611
H8CA13096,"WELLS, LAURA",GRE,CA,13,"{2018,2020}",LAURA WELLS FOR CONGRESS,C00683144
H8CA15109,"ST JOHN, ERICK BRENDAN",NPA,CA,15,{2018},BRENDAN FOR CONGRESS,C00646695
H8CA15117,"PETERS, RUDY PETERS",REP,CA,15,"{2018,2020}",RUDY PETERS FOR CONGRESS,C00671370
H8CA16065,"HENG, ELIZABETH",UNK,CA,16,"{2018,2020}",HELPING ELECT THE NEXT GENERATION PAC (HENG PAC),C00685735
H8CA16065,"HENG, ELIZABETH",UNK,CA,16,"{2018,2020}",ELIZABETH HENG FOR CONGRESS,C00670257
H8CA17097,"TRAN, KHANH",DEM,CA,17,{2018},KHANH TRAN FOR CONGRESS DISTRICT 17,C00640607
H8CA18079,"MELILLO, MICHAEL",IND,CA,18,{2018},MICHAEL MELILLO FOR CONGRESS,C00663047
H8CA19051,"AGUILERA, JUSTIN",REP,CA,19,"{2018,2020}",JUSTIN AGUILERA FOR CONGRESS,C00683532
H8CA20083,"CHEADER, ROBERT NEIL",IND,CA,20,{2018},ROBERT CHEADER FOR CONGRESS,C00640821
H8CA22139,"JANZ, ANDREW",DEM,CA,22,"{2018,2020}",ANDREW JANZ FOR CONGRESS,C00638510
H8CA22147,"FRANCO, RICARDO JOSE",DEM,CA,22,"{2018,2020}",FRANCO FOR CONGRESS,C00649095
H8CA22154,"BLIATOUT, BOBBY",DEM,CA,22,{2018},BOBBY FOR CONGRESS,C00649533
H8CA22162,"CARROLL, BRIAN",NOP,CA,22,{2018},BRIAN T CARROLL CITIZENS FOR,C00664987
H8CA22170,"WILLIAMS, BRANT JOHN-MICHAEL",DEM,CA,22,"{2018,2020}",B. JOHN-MICHAEL WILLIAMS FOR CA-22,C00666495
H8CA23095,"OWEN, ROBERT THURMAN III",DEM,CA,23,{2018},ROBERT OWEN FOR CONGRESS,C00636357
H8CA23103,"MATTA, TATIANA",DEM,CA,23,"{2018,2020}",TATIANA MATTA FOR CONGRESS,C00653592
H8CA23111,"WILSON, KURTIS",DEM,CA,23,"{2018,2020}",KURTIS WILSON FOR CONGRESS 2018,C00657114
H8CA23129,"BARRO, MARY",DEM,CA,23,"{2018,2020}",MARY HELEN BARRO FOR REPRESENTATIVE,C00670760
H8CA23137,"DAVIS, JAMES",NOP,CA,23,"{2018,2020}",COMMITTEE TO ELECT JAMES DAVIS DEVIANT FOR CONGRESS 2018,C00671438
H8CA24150,"WOODY, MICHAEL",REP,CA,24,"{2018,2020}",MICHAEL ERIN WOODY FOR CONGRESS,C00638080
H8CA25066,"FARRELL-SMITH, KELAN JOHN MR.",DEM,CA,25,"{2018,2020}",KELAN JOHN FARRELL-SMITH FOR HOUSE OF REPRESENTATIVES CALIFORNIA'S 25TH DISTRICT,C00632638
H8CA25074,"HILL, KATHERINE LAUREN",DEM,CA,25,"{2018,2020}",KATIE HILL FOR CONGRESS,C00634212
H8CA25082,"PHOENIX, JESS",DEM,CA,25,"{2018,2020}",JESS PHOENIX FOR CONGRESS,C00637827
H8CA25108,"GREENAWAY, DIEDRA MICHELLE",DEM,CA,25,{2018},COMMITTEE TO ELECT DIEDRA GREENAWAY FOR CONGRESS 2018,C00656355
H8CA25116,"MCVARISH, SCOTT",DEM,CA,25,{2018},SCOTT MCVARISH FOR CONGRESS,C00659433
H8CA25124,"MASTERMAN-SMITH, MIKE",DEM,CA,25,"{2018,2020}","MASTERMAN-SMITH, MIKE",C00666289
H8CA26106,"SKELTON, SHANE JOHN",REP,CA,26,{2018},SHANE SKELTON FOR CONGRESS,C00636514
H8CA26114,"SABATO, ANTONIO",REP,CA,26,"{2018,2020}",ANTONIO SABATO JR FOR CONGRESS,C00639690
H8CA26122,"BURUM, JEFFREY DAVID MAJ (RET)",REP,CA,26,"{2018,2020}",JEFFREY BURUM FOR CONGRESS,C00653949
H8CA26130,"NELSON, JOHN",DEM,CA,26,"{2018,2020}",JOHN NELSON FOR CONGRESS,C00655282
H8CA27104,"ESPINOZA, BRIAN ANTHONY MR.",LIB,CA,27,{2018},BESTPINOZA FOR HOUSE,C00650325
H8CA27112,"WITT, BRYAN",DEM,CA,27,"{2018,2020}",BRYAN WITT FOR CONGRESS,C00654335
H8CA27120,"CARDENAS, BEATRICE I",REP,CA,27,{2018},CARDENAS FOR CONGRESS,C00668020
H8CA28169,"NICHOLS, DAMIEN MICHAEL",DEM,CA,28,{2018},DAMIEN NICHOLS FOR CONGRESS,C00632703
H8CA28177,"MARKOS, JUAN",NPA,CA,28,"{2018,2020}",JUAN MARKOS FOR CONGRESS DISTRICT 28 2018,C00635466
H8CA28185,"NALBANDIAN, JOHNNY",REP,CA,28,"{2018,2020}",JOHNNY FOR CONGRESS,C00651547
H8CA28193,"SHAYANI, PAYAM MARK MR.",IND,CA,28,"{2018,2020}",SHAYANI FOR CONGRESS 2018,C00659326
H8CA29100,"DUENAS, ANGELICA",GRE,CA,29,"{2018,2020}",ANGELICA DUENAS FOR CONGRESS,C00648634
H8CA30066,"PELZER, JONATHAN",DEM,CA,30,{2018},PELZER FOR CONGRESS,C00648527
H8CA32070,"QUINTERO, ANDRE",DEM,CA,32,"{2018,2020}",ANDRE QUINTERO FOR CONGRESS,C00632885
H8CA32088,"SCOTT, JOSHUA",REP,CA,32,"{2018,2020}",JOSHUA SCOTT FOR CONGRESS,C00682179
H8CA33268,"RODGERS, EMORY",DEM,CA,33,"{2018,2020}",THE COMMITTEE TO ELECT MR. RODGERS,C00674721
H8CA34183,"CABILDO, MARIA",DEM,CA,34,"{2018,2020}",MARIA CABILDO FOR CONGRESS,C00630517
H8CA34191,"MENDOZA, SANDRA",DEM,CA,34,"{2018,2020}",SANDRA MENDOZA FOR CONGRESS,C00630913
H8CA34225,"WALKER, MICHELLE ""HOPE""",DEM,CA,34,"{2018,2020}","VOTE FOR MICHELLE ""HOPE"" WALKER FOR UNITED STATES OF AMERICA REPRESENTATIVE",C00632422
H8CA34233,"PADILLA, MARK EDWARD",NPA,CA,34,{2018},PADILLA 4 CONGRESS,C00632414
H8CA34241,"WALLACE, TENAYA",DEM,CA,34,"{2018,2020}",TENAYA4CONGRESS,C00632315
H8CA34258,"AHN, ROBERT LEE",DEM,CA,34,"{2018,2020}",ROBERT LEE AHN FOR CONGRESS,C00631564
H8CA34274,"DE LA FUENTE, RICARDO",DEM,CA,34,{2018},RICARDO4CONGRESS,C00632471
H8CA34282,"VAN HOUTEN, TRACY",DEM,CA,34,{2018},TRACY VAN HOUTEN FOR CONGRESS,C00633024
H8CA34324,"MCARDLE, ANGELA E.",LIB,CA,34,{2018},ANGELA MCARDLE FOR CONGRESS,C00635409
H8CA34340,"ALVAREZ, SIMON MARK",REP,CA,34,"{2018,2020}",SIMON ALVAREZ FOR CONGRESS,C00635011
H8CA34340,"ALVAREZ, SIMON MARK",REP,CA,34,"{2018,2020}",SIMON ALVAREZ AS YOUR CONGRESSMAN,C00656652
H8CA35115,"VALIENTE, CHRISTIAN",REP,CA,35,"{2018,2020}",CHRISTIAN L VALIENTE COMMITTEE TO ELECT FOR CONGRESS,C00659243
H8CA36162,"BALL, DAN",REP,CA,36,"{2018,2020}",DAN BALL FOR CONGRESS,C00657395
H8CA36170,"PELZER, KIMBERLIN BROWN",REP,CA,36,"{2018,2020}",KIMBERLIN BROWN PELZER FOR CONGRESS,C00657676
H8CA36188,"WOLKOWICZ, STEPHAN",REP,CA,36,{2018},WOLKOWICZ FOR CONGRESS,C00659821
H8CA36196,"BENTLEY, ROBERT",REP,CA,36,"{2018,2020}",ROBERT BENTLEY FOR CONGRESS,C00660936
H8CA36204,"HASSETT, DOUGLAS",REP,CA,36,{2018},DOUG HASSETT FOR CONGRESS 2018,C00661363
H8CA37293,"BASSILIAN, RON",REP,CA,37,"{2018,2020}",BASSILIAN FOR CONGRESS,C00652222
H8CA37301,"ALEMAYHU, TED",OTH,CA,39,"{2018,2020}",COMMITTEE TO ELECT TED  M. ALEMAYHU,C00638734
H8CA39133,"JANOWICZ, PHIL ANDREW DR.",DEM,CA,39,"{2018,2020}",FRIENDS OF PHIL JANOWICZ,C00638478
H8CA39141,"CASTANEDA, JULIO MR.",NNE,CA,39,"{2018,2020}",JULIO CASTANEDA FOR US CONGRESS,C00640284
H8CA39158,"TRAN, MAI-KHANH",DEM,CA,39,"{2018,2020}",DR TRAN FOR CONGRESS,C00647081
H8CA39166,"JAMMAL, SAMIR",DEM,CA,39,"{2018,2020}",SAM JAMMAL FOR CONGRESS,C00650523
H8CA39174,"CISNEROS, GILBERT",DEM,CA,39,"{2018,2020}",CISNEROS FOR CONGRESS,C00650648
H8CA39182,"THORBURN, ANDY",DEM,CA,39,"{2018,2020}",ANDY THORBURN FOR CONGRESS,C00652107
H8CA39190,"COX, STEVE",IND,CA,39,"{2018,2020}",STEVE COX FOR CONGRESS,C00653972
H8CA39208,"RUSK, TED",DEM,CA,39,{2018},TED RUSK FOR CONGRESS,C00656488
H8CA39216,"SAREGA, ANDREW",REP,CA,39,{2018},SAREGA FOR CONGRESS 2018,C00665539
H8CA39224,"HUFF, BOB",REP,CA,39,{2018},BOB HUFF FOR CONGRESS,C00665802
H8CA39232,"NELSON, SHAWN",REP,CA,39,"{2018,2020}",SHAWN NELSON FOR CONGRESS,C00665836
H8CA39240,"KIM, YOUNG",REP,CA,39,"{2018,2020}",YOUNG KIM FOR CONGRESS,C00665638
H8CA39257,"LEGGETT, SUZI",DEM,CA,39,"{2018,2020}",SUZI PARK LEGGETT FOR CONGRESS COMMITTEE,C00666768
H8CA39257,"LEGGETT, SUZI",DEM,CA,39,"{2018,2020}",SUZI P LEGGETT,C00674846
H8CA39265,"STEED, CYBIL CAMILLE",DEM,CA,39,{2018},STAND WITH STEED,C00667071
H8CA39273,"ALEXANDER, SOPHIA JOSEPHINE 8506376927",IND,CA,39,"{2018,2020}",SOPHIA ALEXANDER CAMPAIGN FOR CONGRESS,C00670000
H8CA39281,"VARGAS, STEVEN",REP,CA,39,"{2018,2020}",STEVEN VARGAS FOR CONGRESS,C00670562
H8CA39299,"LEE, HERBERT",DEM,CA,39,"{2018,2020}",HERBERT LEE MD FOR CONGRESS,C00672634
H8CA39307,"LIBERATORE, PHIL",REP,CA,39,"{2018,2020}",LIBERATORE FOR CONGRESS-2018,C00674325
H8CA40206,"CORTES BARRAGAN, RODOLFO",GRE,CA,40,"{2018,2020}",RODOLFO CORTES BARRAGAN COMMITTEE TO ELECT FOR CONGRESS,C00664185
H8CA41170,"SMITH, AJA",REP,CA,41,"{2018,2020}",AJA SMITH FOR CONGRESS,C00635854
H8CA42228,"PEACOCK, JULIA C.",DEM,CA,42,"{2018,2020}",JULIA PEACOCK FOR CONGRESS,C00634014
H8CA42236,"WOODY, MATT",NNE,CA,42,"{2018,2020}",THE PEOPLE FOR MATT WOODY,C00648196
H8CA42244,"QUINTERO, NORMAN",DEM,CA,42,{2018},NORMAN QUINTERO FOR US CONGRESS,C00660803
H8CA43127,"CAMPER, CANDANCE MS",REP,CA,43,{2018},CAMPER FOR CONGRESS,C00649442
H8CA43135,"DUTERTE, EDWIN",REP,CA,43,{2018},DUTERTE FOR CONGRESS,C00653360
H8CA43143,"DEMARTINI, FRANK",REP,CA,43,{2018},FRANK DEMARTINI CONGRESSIONAL CAMPAIGN COMMITTEE,C00656173
H8CA43150,"ZUNIGA, MIGUEL",GRE,CA,43,"{2018,2020}",MIGUEL ANGEL ZUNIGA,C00663021
H8CA43168,"COLLINS, JOE EDWARD",DEM,CA,43,"{2018,2020}",COLLINS4CONGRESS,C00669705
H8CA44109,"DASH, STACEY",REP,CA,44,{2018},DASH TO DC,C00671347
H8CA44117,"BROWN, AJA",DEM,CA,44,"{2018,2020}",AJA BROWN FOR CONGRESS,C00672436
H8CA45130,"PORTER, KATHERINE",DEM,CA,45,"{2018,2020}",KATIE PORTER FOR CONGRESS,C00636571
H8CA45148,"MIN, DAVID",DEM,CA,45,{2018},DAVE MIN FOR CONGRESS,C00636845
H8CA45155,"HAMADANCHY, KIA",DEM,CA,45,{2018},KIA FOR CONGRESS,C00636951
H8CA45163,"RYWALSKI, ERIC",DEM,CA,45,{2018},ERIC RYWALSKI FOR CONGRESS,C00639534
H8CA45171,"RAMSAY, GREGORY ROBERT 7145321445",DEM,CA,45,"{2018,2020}",FRIENDS OF GREG RAMSAY FOR CONGRESS,C00651703
H8CA45189,"FORDE, BRIAN",DEM,CA,45,"{2018,2020}",BRIAN FORDE FOR CONGRESS,C00650911
H8CA45197,"GRAHAM, JOHN",NNE,CA,45,{2018},JOHN LAWRENCE GRAHAM PLAN ADMINISTRATOR,C00656892
H8CA46120,"LAMBERT, RUSSELL RENE",REP,CA,46,"{2018,2020}",RUSS LAMBERT FOR CONGRESS,C00667972
H8CA47060,"CLIFFORD, DAVID",REP,CA,47,"{2018,2020}",DAVID CLIFFORD FOR CONGRESS,C00663013
H8CA47078,"BRISCOE, JOHN",REP,CA,47,"{2018,2020}",BRISCOE 4 CONGRESS,C00671784
H8CA48035,"ROUDA, HARLEY E JR",DEM,CA,48,"{2018,2020}",HARLEY ROUDA FOR CONGRESS,C00633982
H8CA48043,"OATMAN, LAURA",DEM,CA,48,"{2018,2020}",OATMAN FOR CONGRESS,C00636969
H8CA48050,"ZARKADES, TONY",DEM,CA,48,{2018},TONYZFORCONGRESS,C00638585
H8CA48068,"REISER, BRANDON",LIB,CA,48,{2018},REISER 2018,C00646828
